{
  "schemaVersion": 1,
  "kind": "program-audio-mix-registry",
  "scanRoot": "scripts/producer",
  "discoveryTokens": [
    "amix=inputs=",
    "amerge=inputs=",
    "join=inputs=",
    "acrossfade=",
    "sidechaincompress=",
    "v=0:a=1"
  ],
  "consumers": [
    {
      "id": "native-retained-dialogue-float-concat",
      "path": "scripts/producer/studio/native_short_dialogue.py",
      "sourceToken": "concat=n={len(canvas[\"cuts\"])}:v=0:a=1",
      "expectedOccurrences": 1,
      "consumerKind": "derived-program-mix",
      "normalizationAuthority": "retained cuts of the same declared dialogue source are concatenated as float PCM; dialogue_premaster then requires content-bound channel normalization of that complete reference before audio finishing or loudness mastering",
      "authorityPaths": [
        "scripts/producer/studio/native_short_dialogue.py",
        "scripts/producer/studio/native_short_delivery.py",
        "scripts/producer/audio/channel_normalization.py"
      ],
      "testPaths": [
        "scripts/producer/tests/test_native_dialogue_channels.py",
        "scripts/producer/tests/test_native_audio_preparation.py"
      ],
      "exemption": null
    },
    {
      "id": "music-final-program-mix",
      "path": "scripts/producer/audio/audio_mix.py",
      "sourceToken": "[d][b]amix=inputs=2",
      "expectedOccurrences": 1,
      "consumerKind": "program-mix",
      "normalizationAuthority": "run_audio_mix materializes the content-bound first-audio receipt to stereo PCM before every pass",
      "authorityPaths": [
        "scripts/producer/audio/channel_normalization.py",
        "scripts/producer/audio/channel_normalization_media.py"
      ],
      "testPaths": [
        "scripts/producer/tests/test_channel_normalization_mix_paths.py"
      ],
      "exemption": null
    },
    {
      "id": "music-sidechain-program-control",
      "path": "scripts/producer/audio/audio_mix.py",
      "sourceToken": "[bed][key]sidechaincompress=",
      "expectedOccurrences": 1,
      "consumerKind": "program-control",
      "normalizationAuthority": "the sidechain key reads the same materialized normalized program used by the final amix",
      "authorityPaths": [
        "scripts/producer/audio/channel_normalization.py",
        "scripts/producer/audio/channel_normalization_media.py"
      ],
      "testPaths": [
        "scripts/producer/tests/test_channel_normalization_mix_paths.py"
      ],
      "exemption": null
    },
    {
      "id": "music-loop-bed-asset-mix",
      "path": "scripts/producer/audio/audio_mix_bed.py",
      "sourceToken": "[tail][head]amix=inputs=2",
      "expectedOccurrences": 1,
      "consumerKind": "asset-only-mix",
      "normalizationAuthority": "not applicable because both legs are overlapping windows of one music asset and no program or dialogue leg enters",
      "authorityPaths": [
        "scripts/producer/audio/audio_mix_bed.py"
      ],
      "testPaths": [
        "scripts/producer/tests/test_audio_mix_render.py"
      ],
      "exemption": "asset-only seam smoothing; neither input is program dialogue"
    },
    {
      "id": "music-loop-bed-asset-concat",
      "path": "scripts/producer/audio/audio_mix_bed.py",
      "sourceToken": "[x][body]concat=n=2:v=0:a=1",
      "expectedOccurrences": 1,
      "consumerKind": "asset-only-mix",
      "normalizationAuthority": "not applicable because both concat legs are windows of the same normalized music-bed asset",
      "authorityPaths": [
        "scripts/producer/audio/audio_mix_bed.py"
      ],
      "testPaths": [
        "scripts/producer/tests/test_audio_mix_render.py"
      ],
      "exemption": "asset-only music length fitting; no program or dialogue input exists"
    },
    {
      "id": "demucs-derived-stem-remix",
      "path": "scripts/producer/audio/audio_separate.py",
      "sourceToken": "[1:a][res]amix=inputs=2",
      "expectedOccurrences": 1,
      "consumerKind": "derived-program-mix",
      "normalizationAuthority": "run_separate observes the source and extract_wav repairs it before Demucs derives both remix stems",
      "authorityPaths": [
        "scripts/producer/audio/audio_separate.py",
        "scripts/producer/audio/channel_normalization.py"
      ],
      "testPaths": [
        "scripts/producer/tests/test_channel_normalization_mix_paths.py"
      ],
      "exemption": null
    },
    {
      "id": "exact-dialogue-program-mix",
      "path": "scripts/producer/audio/dialogue_program_media.py",
      "sourceToken": "amix=inputs={count}:duration=first",
      "expectedOccurrences": 1,
      "consumerKind": "program-mix",
      "normalizationAuthority": "the dialogue input is exact mono PCM whose source proofs each contain a verified channel-normalization receipt; auxiliary roles are separately pinned",
      "authorityPaths": [
        "scripts/producer/audio/dialogue_stem_probe.py",
        "scripts/producer/audio/dialogue_stem_receipt.py",
        "scripts/producer/audio/dialogue_program_render.py"
      ],
      "testPaths": [
        "scripts/producer/tests/test_p2_dialogue_stem_render.py",
        "scripts/producer/tests/test_p2_dialogue_program_render.py"
      ],
      "exemption": null
    },
    {
      "id": "exact-dialogue-entry-mix",
      "path": "scripts/producer/audio/dialogue_stem_mix.py",
      "sourceToken": "amix=inputs={len(placements) + 1}",
      "expectedOccurrences": 1,
      "consumerKind": "derived-program-mix",
      "normalizationAuthority": "every placement is cut from a mono PCM source decoded only after its pinned channel-normalization receipt is proved",
      "authorityPaths": [
        "scripts/producer/audio/dialogue_stem_probe.py",
        "scripts/producer/audio/dialogue_stem_render.py"
      ],
      "testPaths": [
        "scripts/producer/tests/test_p2_dialogue_stem_render.py"
      ],
      "exemption": null
    },
    {
      "id": "sfx-library-synthesis-mix",
      "path": "scripts/producer/audio/sfx_library.py",
      "sourceToken": "[hb][mb][lb]amix=inputs=3",
      "expectedOccurrences": 1,
      "consumerKind": "asset-only-mix",
      "normalizationAuthority": "not applicable because all three legs are generated frequency bands of one seeded SFX asset",
      "authorityPaths": [
        "scripts/producer/audio/sfx_library.py"
      ],
      "testPaths": [
        "scripts/producer/tests/test_sfx_icons.py"
      ],
      "exemption": "asset-only SFX synthesis; no program or dialogue input exists"
    },
    {
      "id": "transition-whoosh-synthesis-mix",
      "path": "scripts/producer/motion/transitions.py",
      "sourceToken": "[hb][mb][lb]amix=inputs=3",
      "expectedOccurrences": 1,
      "consumerKind": "asset-only-mix",
      "normalizationAuthority": "not applicable because all three legs synthesize one deterministic whoosh asset before it reaches the program mix",
      "authorityPaths": [
        "scripts/producer/motion/transitions.py"
      ],
      "testPaths": [
        "scripts/producer/tests/test_motion.py"
      ],
      "exemption": "asset-only whoosh synthesis; no program or dialogue input exists"
    },
    {
      "id": "transition-program-sfx-mix",
      "path": "scripts/producer/motion/transitions.py",
      "sourceToken": "amix=inputs={len(delayed) + 1}",
      "expectedOccurrences": 1,
      "consumerKind": "program-mix",
      "normalizationAuthority": "Retained internal audio preparation helper: _transition_audio injects the observed stereo filter. The public apply_transitions entry point unconditionally rejects retired visual presets before media or output work.",
      "authorityPaths": [
        "scripts/producer/audio/channel_normalization.py",
        "scripts/producer/motion/transitions.py"
      ],
      "testPaths": [
        "scripts/producer/tests/test_channel_normalization_mix_paths.py",
        "scripts/producer/tests/test_motion.py"
      ],
      "exemption": null
    },
    {
      "id": "cut-jcut-program-concat",
      "path": "scripts/producer/cut_speed.py",
      "sourceToken": "[own][tail]concat=n=2:v=0:a=1",
      "expectedOccurrences": 1,
      "consumerKind": "derived-program-mix",
      "normalizationAuthority": "render_cut_speed observes every unique source once and applies its exact stereo filter before own and J-cut tail extraction",
      "authorityPaths": [
        "scripts/producer/audio/cut_channel_normalization.py",
        "scripts/producer/audio/cut_audio_filters.py",
        "scripts/producer/cut_speed.py"
      ],
      "testPaths": [
        "scripts/producer/tests/test_channel_normalization_mix_paths.py"
      ],
      "exemption": null
    },
    {
      "id": "ordinary-source-float-jcut-concat",
      "path": "scripts/producer/audio/render_audio_bus.py",
      "sourceToken": "[own][tail]concat=n=2:v=0:a=1",
      "expectedOccurrences": 1,
      "consumerKind": "derived-program-mix",
      "normalizationAuthority": "the explicit fresh unity-speed adapter verifies same-cut source/channel receipts for own and incoming J-cut legs before the shared stereo float filter; silent input requires observed audio absence",
      "authorityPaths": [
        "scripts/producer/audio/render_audio_authority.py",
        "scripts/producer/audio/render_audio_bus.py",
        "scripts/producer/audio/cut_audio_filters.py"
      ],
      "testPaths": [
        "scripts/producer/tests/test_render_source_audio_media.py",
        "scripts/producer/tests/test_channel_normalization_mix_paths.py"
      ],
      "exemption": null
    },
    {
      "id": "ordinary-source-float-byte-concat",
      "path": "scripts/producer/audio/render_audio_bus.py",
      "sourceToken": "def _concat(",
      "expectedOccurrences": 1,
      "consumerKind": "derived-program-mix",
      "normalizationAuthority": "each normalized float part is bound to executed cut frames and source/channel authority; byte concatenation checks each part hash and total samples before wrapping the retained unmastered WAV",